{
  "format": "occt-research-brepoffset-model-v1",
  "meta": {
    "case": "null_offset_0",
    "kind": "offset_shape",
    "occt_version": "7.9.3",
    "occt_dev": ""
  },
  "params": {
    "offset": 0,
    "tol": 9.9999999999999995e-07,
    "mode": "BRepOffset_Skin",
    "join_type": "GeomAbs_Arc",
    "intersection": false,
    "self_inter": false,
    "remove_internal_edges": false
  },
  "input":
    {
      "counts": {"solids": 1, "shells": 1, "faces": 6, "edges": 12, "vertices": 8},
      "bbox": {"min": [-9.9999999999999995e-08, -9.9999999999999995e-08, -9.9999999999999995e-08], "max": [10.000000099999999, 10.000000099999999, 10.000000099999999]}
    },
  "precheck": {
    "ok": false,
    "bad_shape": null
  },
  "result": {
    "is_done": false,
    "error_name": "BRepOffset_NullOffset",
    "shape": null
  },
  "history": {
    "faces": [
      {"input_index": 1, "has_image": false, "n_images": 0, "n_last_images": 0},
      {"input_index": 2, "has_image": false, "n_images": 0, "n_last_images": 0},
      {"input_index": 3, "has_image": false, "n_images": 0, "n_last_images": 0},
      {"input_index": 4, "has_image": false, "n_images": 0, "n_last_images": 0},
      {"input_index": 5, "has_image": false, "n_images": 0, "n_last_images": 0},
      {"input_index": 6, "has_image": false, "n_images": 0, "n_last_images": 0}
    ],
    "edges": [
      {"input_index": 1, "has_image": false, "n_images": 0, "n_last_images": 0},
      {"input_index": 2, "has_image": false, "n_images": 0, "n_last_images": 0},
      {"input_index": 3, "has_image": false, "n_images": 0, "n_last_images": 0},
      {"input_index": 4, "has_image": false, "n_images": 0, "n_last_images": 0},
      {"input_index": 5, "has_image": false, "n_images": 0, "n_last_images": 0},
      {"input_index": 6, "has_image": false, "n_images": 0, "n_last_images": 0},
      {"input_index": 7, "has_image": false, "n_images": 0, "n_last_images": 0},
      {"input_index": 8, "has_image": false, "n_images": 0, "n_last_images": 0},
      {"input_index": 9, "has_image": false, "n_images": 0, "n_last_images": 0},
      {"input_index": 10, "has_image": false, "n_images": 0, "n_last_images": 0},
      {"input_index": 11, "has_image": false, "n_images": 0, "n_last_images": 0},
      {"input_index": 12, "has_image": false, "n_images": 0, "n_last_images": 0}
    ]
  }
}
